{
  "$schema": "./ci-check-catalog.schema.json",
  "schema_version": 1,
  "catalog_version": "1.1.3",
  "repository": "egorribun/university_ecosystem",
  "default_runbook": "docs/testing/ci-check-catalog-runbook.md",
  "profiles": {
    "required-pr-main": {
      "classification": "required",
      "required_events": [
        "pull_request_main",
        "push_main"
      ],
      "owner": "@egorribun",
      "runbook": "docs/testing/ci-check-catalog-runbook.md",
      "artifacts": [],
      "retry_policy": {
        "mode": "none",
        "first_failure_preserved": true,
        "classifier": "not_applicable",
        "review_required": false
      },
      "notes": "Required on pull requests and main pushes; exact branch protection remains a separate policy source."
    },
    "required-pr": {
      "classification": "required",
      "required_events": [
        "pull_request_main"
      ],
      "owner": "@egorribun",
      "runbook": "docs/testing/ci-check-catalog-runbook.md",
      "artifacts": [],
      "retry_policy": {
        "mode": "none",
        "first_failure_preserved": true,
        "classifier": "not_applicable",
        "review_required": false
      },
      "notes": "Required on pull requests targeting main."
    },
    "required-main": {
      "classification": "required",
      "required_events": [
        "push_main"
      ],
      "owner": "@egorribun",
      "runbook": "docs/testing/ci-check-catalog-runbook.md",
      "artifacts": [],
      "retry_policy": {
        "mode": "none",
        "first_failure_preserved": true,
        "classifier": "not_applicable",
        "review_required": false
      },
      "notes": "Required on main pushes."
    },
    "advisory": {
      "classification": "advisory",
      "required_events": [],
      "owner": "@egorribun",
      "runbook": "docs/testing/ci-check-catalog-runbook.md",
      "artifacts": [],
      "retry_policy": {
        "mode": "none",
        "first_failure_preserved": true,
        "classifier": "not_applicable",
        "review_required": false
      },
      "notes": "Informational or policy-independent check; never inferred to be branch-protection required."
    },
    "live-acceptance": {
      "classification": "advisory",
      "required_events": [],
      "owner": "@egorribun",
      "runbook": "docs/testing/ci-check-catalog-runbook.md",
      "artifacts": [],
      "retry_policy": {
        "mode": "none",
        "first_failure_preserved": true,
        "classifier": "not_applicable",
        "review_required": false
      },
      "notes": "Non-required live evidence: pull requests run auth/reset smoke, while scheduled and manually dispatched default-branch runs execute the full suite."
    },
    "nightly": {
      "classification": "nightly",
      "required_events": [],
      "owner": "@egorribun",
      "runbook": "docs/testing/ci-check-catalog-runbook.md",
      "artifacts": [],
      "retry_policy": {
        "mode": "none",
        "first_failure_preserved": true,
        "classifier": "not_applicable",
        "review_required": false
      },
      "notes": "Scheduled or scheduled/manual evidence lane."
    },
    "manual": {
      "classification": "manual",
      "required_events": [],
      "owner": "@egorribun",
      "runbook": "docs/testing/ci-check-catalog-runbook.md",
      "artifacts": [],
      "retry_policy": {
        "mode": "none",
        "first_failure_preserved": true,
        "classifier": "not_applicable",
        "review_required": false
      },
      "notes": "Explicit workflow_dispatch lane."
    },
    "internal": {
      "classification": "internal",
      "required_events": [],
      "owner": "@egorribun",
      "runbook": "docs/testing/ci-check-catalog-runbook.md",
      "artifacts": [],
      "retry_policy": {
        "mode": "none",
        "first_failure_preserved": true,
        "classifier": "not_applicable",
        "review_required": false
      },
      "notes": "Reusable workflow implementation; required/advisory policy comes from its caller."
    },
    "external-required-pr": {
      "classification": "required",
      "required_events": [
        "pull_request_main"
      ],
      "owner": "@github-advanced-security",
      "runbook": "docs/testing/ci-check-catalog-runbook.md",
      "artifacts": [],
      "retry_policy": {
        "mode": "none",
        "first_failure_preserved": true,
        "classifier": "provider-managed",
        "review_required": false
      },
      "notes": "Provider-managed required context; live ruleset ownership and current conclusion are refreshed separately."
    },
    "required-pr-target-main": {
      "classification": "required",
      "required_events": [
        "pull_request_target_main"
      ],
      "owner": "@egorribun",
      "runbook": "docs/testing/ci-check-catalog-runbook.md",
      "artifacts": [],
      "retry_policy": {
        "mode": "none",
        "first_failure_preserved": true,
        "classifier": "not_applicable",
        "review_required": false
      },
      "notes": "Base-branch-only policy integrity gate; it never executes pull-request code and must remain required for pull requests targeting main."
    }
  },
  "external_checks": [
    {
      "provider": "github-advanced-security",
      "integration_id": 57789,
      "context": "CodeQL",
      "profile": "external-required-pr",
      "classification": "required",
      "owner": "@github-advanced-security",
      "source_reference": ".github/workflows/codeql.yml; live provider context evidence is refreshed with gh api",
      "runbook": "docs/testing/ci-check-catalog-runbook.md",
      "externally_owned": true
    },
    {
      "provider": "github-advanced-security",
      "integration_id": 57789,
      "context": "Checkov",
      "profile": "external-required-pr",
      "classification": "required",
      "owner": "@github-advanced-security",
      "source_reference": ".github/workflows/checkov.yml; live provider context evidence is refreshed with gh api",
      "runbook": "docs/testing/ci-check-catalog-runbook.md",
      "externally_owned": true
    },
    {
      "provider": "github-advanced-security",
      "integration_id": 57789,
      "context": "spectral",
      "profile": "external-required-pr",
      "classification": "required",
      "owner": "@github-advanced-security",
      "source_reference": ".github/workflows/contract-validation.yml; live provider context evidence is refreshed with gh api",
      "runbook": "docs/testing/ci-check-catalog-runbook.md",
      "externally_owned": true
    },
    {
      "provider": "github-advanced-security",
      "integration_id": 57789,
      "context": "zizmor",
      "profile": "external-required-pr",
      "classification": "required",
      "owner": "@github-advanced-security",
      "source_reference": ".github/workflows/zizmor.yml; live provider context evidence is refreshed with gh api",
      "runbook": "docs/testing/ci-check-catalog-runbook.md",
      "externally_owned": true
    }
  ],
  "expansions": [
    {
      "id": "backend-tests-units",
      "kind": "reusable_workflow",
      "caller_workflow_path": ".github/workflows/ci.yml",
      "caller_job_id": "backend-tests",
      "reusable_workflow_path": ".github/workflows/reusable-backend-tests.yml",
      "reusable_job_ids": [
        "unit-tests"
      ],
      "profile": "required-pr-main",
      "classification": "required",
      "owner": "@egorribun",
      "runbook": "docs/testing/ci-check-catalog-runbook.md",
      "source_reference": ".github/workflows/ci.yml#jobs.backend-tests -> reusable-backend-tests.yml#jobs.unit-tests",
      "declared_contexts": [
        "Backend Tests (Python 3.14-shard-0) / Unit Tests (All-Python 3.14-shard-0)",
        "Backend Tests (Python 3.14-shard-1) / Unit Tests (All-Python 3.14-shard-1)",
        "Backend Tests (Python 3.14-shard-2) / Unit Tests (All-Python 3.14-shard-2)",
        "Backend Tests (Python 3.14-shard-3) / Unit Tests (All-Python 3.14-shard-3)"
      ]
    },
    {
      "id": "frontend-tests-protected",
      "kind": "reusable_workflow",
      "caller_workflow_path": ".github/workflows/ci.yml",
      "caller_job_id": "frontend-tests",
      "reusable_workflow_path": ".github/workflows/reusable-frontend-tests.yml",
      "reusable_job_ids": [
        "bundle-analysis",
        "lint",
        "build",
        "wasm-tests",
        "unit-tests-shard",
        "unit-tests"
      ],
      "profile": "required-pr-main",
      "classification": "required",
      "owner": "@egorribun",
      "runbook": "docs/testing/ci-check-catalog-runbook.md",
      "source_reference": ".github/workflows/ci.yml#jobs.frontend-tests -> reusable-frontend-tests.yml#jobs.{bundle-analysis,lint,build,wasm-tests,unit-tests-shard,unit-tests}",
      "declared_contexts": [
        "Frontend Tests / Bundle Analysis",
        "Frontend Tests / Lint & Format",
        "Frontend Tests / Production Build",
        "Frontend Tests / WASM Contract Tests",
        "Frontend Tests / Unit Tests",
        "Frontend Tests / Unit Tests (shard 1/4)",
        "Frontend Tests / Unit Tests (shard 2/4)",
        "Frontend Tests / Unit Tests (shard 3/4)",
        "Frontend Tests / Unit Tests (shard 4/4)"
      ]
    },
    {
      "id": "nightly-browser-matrix",
      "kind": "reusable_workflow",
      "caller_workflow_path": ".github/workflows/nightly-full-gate.yml",
      "caller_job_id": "browser-matrix",
      "reusable_workflow_path": ".github/workflows/reusable-e2e-tests.yml",
      "reusable_job_ids": [
        "e2e"
      ],
      "profile": "nightly",
      "classification": "nightly",
      "owner": "@egorribun",
      "runbook": "docs/testing/ci-check-catalog-runbook.md",
      "source_reference": ".github/workflows/nightly-full-gate.yml#jobs.browser-matrix -> reusable-e2e-tests.yml#jobs.e2e",
      "declared_contexts": [
        "Browser matrix (chromium 1/4) / E2E Tests (chromium)",